{
  "schemaVersion": "verification-manifest-amendment-request.v1",
  "paths": {
    "input": "tools/milestone-orchestrator/config/source-commissioning-input.json",
    "policy": "tools/milestone-orchestrator/config/verification-scope-policy.json",
    "manifest": ".agent/verification-manifest.json"
  },
  "expected": {
    "hashes": {
      "input": "59f053d0b4ed195e2fda8746f8ee018ea3c97706c07f53a37908c40ef41b8629",
      "policy": "b7a8d58db1a894b6fdddad41f61ff2d062c7bad5b3eacbed170521cc23615f29",
      "manifest": "f765765d8082280282151253e616f87a460dbe8c38f17909aa22d7dcb7930dd9"
    },
    "chainTip": null
  },
  "proposed": {
    "input": "{\n  \"schemaVersion\": \"loop-commissioning-input.v1\",\n  \"commissioning\": {\n    \"id\": \"milestone-loop-template-source.v1\",\n    \"targetBranch\": \"master\",\n    \"baseCommit\": \"0f4ab3e5ef39bda07d6e77356ad53fca9136cdd5\",\n    \"profile\": \"readiness\"\n  },\n  \"sources\": {\n    \"configPath\": \"tools/milestone-orchestrator/config/default.json\",\n    \"invariantSuitePath\": \"tools/milestone-orchestrator/config/invariant-suite.json\",\n    \"scopePolicyPath\": \"tools/milestone-orchestrator/config/verification-scope-policy.json\",\n    \"immutableContractLockPath\": \"evals/immutable-contract-lock.json\",\n    \"immutableContractLockSha256\": \"d1166088b00c54af65e8654188adc58a3cabd9d7908820809fe66af28c933050\"\n  },\n  \"objective\": \"Commission the generic verification lifecycle for the milestone-loop template repository.\",\n  \"exclusions\": [\n    \"No frozen authority, calibration, readiness meaning, verifier deadline, or exact command changes.\",\n    \"No product implementation, placeholder replacement, historical-record rewrite, or worked-example migration.\"\n  ],\n  \"focusedCommands\": [\n    {\n      \"id\": \"test-invariants\",\n      \"argv\": [\"pnpm\", \"test:invariants\"],\n      \"tiers\": [\"iteration\", \"candidate\", \"milestone\"],\n      \"expectedArtifactKinds\": [\"invariant-suite-report\"]\n    },\n    {\n      \"id\": \"format-check\",\n      \"argv\": [\"pnpm\", \"format:check\"],\n      \"tiers\": [\"candidate\", \"milestone\"],\n      \"expectedArtifactKinds\": [\"format-report\"]\n    },\n    {\n      \"id\": \"lint\",\n      \"argv\": [\"pnpm\", \"lint\"],\n      \"tiers\": [\"candidate\", \"milestone\"],\n      \"expectedArtifactKinds\": [\"lint-report\"]\n    },\n    {\n      \"id\": \"lint-architecture\",\n      \"argv\": [\"pnpm\", \"lint:architecture\"],\n      \"tiers\": [\"candidate\", \"milestone\"],\n      \"expectedArtifactKinds\": [\"architecture-report\"]\n    },\n    {\n      \"id\": \"typecheck\",\n      \"argv\": [\"pnpm\", \"typecheck\"],\n      \"tiers\": [\"candidate\", \"milestone\"],\n      \"expectedArtifactKinds\": [\"typecheck-report\"]\n    },\n    {\n      \"id\": \"build\",\n      \"argv\": [\"pnpm\", \"build\"],\n      \"tiers\": [\"candidate\", \"milestone\"],\n      \"expectedArtifactKinds\": [\"build-report\"]\n    },\n    {\n      \"id\": \"test-partition-controller-runtime\",\n      \"argv\": [\"pnpm\", \"test:partition:controller-runtime\"],\n      \"tiers\": [\"candidate\", \"milestone\"],\n      \"expectedArtifactKinds\": [\n        \"test-partition-report\",\n        \"test-partition-vitest-report\",\n        \"test-run-summary\"\n      ]\n    },\n    {\n      \"id\": \"test-partition-repository-tooling\",\n      \"argv\": [\"pnpm\", \"test:partition:repository-tooling\"],\n      \"tiers\": [\"candidate\", \"milestone\"],\n      \"expectedArtifactKinds\": [\n        \"test-partition-report\",\n        \"test-partition-vitest-report\",\n        \"test-run-summary\"\n      ]\n    },\n    {\n      \"id\": \"test-partition-adopter-template\",\n      \"argv\": [\"pnpm\", \"test:partition:adopter-template\"],\n      \"tiers\": [\"candidate\", \"milestone\"],\n      \"expectedArtifactKinds\": [\n        \"test-partition-report\",\n        \"test-partition-vitest-report\",\n        \"test-run-summary\"\n      ]\n    },\n    {\n      \"id\": \"test-partition-trusted-container-fixture\",\n      \"argv\": [\"pnpm\", \"test:partition:trusted-container-fixture\"],\n      \"tiers\": [\"candidate\", \"milestone\"],\n      \"expectedArtifactKinds\": [\n        \"test-partition-report\",\n        \"test-partition-vitest-report\",\n        \"test-run-summary\"\n      ]\n    },\n    {\n      \"id\": \"domain-construction-standard\",\n      \"argv\": [\"pnpm\", \"verify:domain-construction-standard\"],\n      \"tiers\": [\"milestone\"],\n      \"expectedArtifactKinds\": [\n        \"domain-construction-standard-proof\",\n        \"independent-domain-construction-standard-proof\",\n        \"domain-construction-standard-vitest-report\",\n        \"domain-construction-standard-worker-parity-report\",\n        \"playwright-report\",\n        \"browser-diagnostics\",\n        \"domain-construction-standard-verification-report\"\n      ]\n    },\n    {\n      \"id\": \"domain-resources\",\n      \"argv\": [\"pnpm\", \"verify:domain-resources\"],\n      \"tiers\": [\"milestone\"],\n      \"expectedArtifactKinds\": [\"domain-resources-report\"]\n    },\n    {\n      \"id\": \"domain-networks\",\n      \"argv\": [\"pnpm\", \"verify:domain-networks\"],\n      \"tiers\": [\"milestone\"],\n      \"expectedArtifactKinds\": [\"domain-networks-report\"]\n    },\n    {\n      \"id\": \"domain-planning\",\n      \"argv\": [\"pnpm\", \"verify:domain-planning\"],\n      \"tiers\": [\"milestone\"],\n      \"expectedArtifactKinds\": [\"domain-planning-report\"]\n    },\n    {\n      \"id\": \"domain-entitlement\",\n      \"argv\": [\"pnpm\", \"verify:domain-entitlement\"],\n      \"tiers\": [\"milestone\"],\n      \"expectedArtifactKinds\": [\"domain-entitlement-report\"]\n    },\n    {\n      \"id\": \"domain-entitlement-standard\",\n      \"argv\": [\"pnpm\", \"verify:domain-entitlement-standard\"],\n      \"tiers\": [\"milestone\"],\n      \"expectedArtifactKinds\": [\"domain-entitlement-standard-report\"]\n    },\n    {\n      \"id\": \"domain-development\",\n      \"argv\": [\"pnpm\", \"verify:domain-development\"],\n      \"tiers\": [\"milestone\"],\n      \"expectedArtifactKinds\": [\"domain-development-report\"]\n    },\n    {\n      \"id\": \"domain-simulation\",\n      \"argv\": [\"pnpm\", \"verify:domain-simulation\"],\n      \"tiers\": [\"milestone\"],\n      \"expectedArtifactKinds\": [\"domain-simulation-report\"]\n    },\n    {\n      \"id\": \"domain-browser\",\n      \"argv\": [\"pnpm\", \"verify:domain-browser\"],\n      \"tiers\": [\"milestone\"],\n      \"expectedArtifactKinds\": [\"domain-browser-report\"]\n    }\n  ],\n  \"requiredProtectedPaths\": [\n    \".agent/completed/loop-recommissioning-verification.json\",\n    \".agent/readiness-profile-activated.json\",\n    \".agent/verification-manifest.json\",\n    \"AGENTS.md\",\n    \"PROJECT_GOAL.md\",\n    \"evals/ACCEPTANCE.md\",\n    \"evals/HIDDEN_VALIDATION_PROTOCOL.md\",\n    \"evals/acceptance-manifest.json\",\n    \"evals/immutable-contract-lock.json\",\n    \"package.json\",\n    \"pnpm-lock.yaml\",\n    \"scripts/verify.mjs\",\n    \"tools/milestone-orchestrator/config/default.json\",\n    \"tools/milestone-orchestrator/config/invariant-suite.json\",\n    \"tools/milestone-orchestrator/config/source-commissioning-input.json\",\n    \"tools/milestone-orchestrator/config/verification-scope-policy.json\"\n  ],\n  \"requiredInvariantSuiteId\": \"milestone-loop-core-invariants.v1\",\n  \"scopePolicyId\": \"milestone-loop-shadow-scope-policy.v2\",\n  \"exactVerification\": {\n    \"argv\": [\"pnpm\", \"verify\"],\n    \"requiresNoArguments\": true,\n    \"profileSource\": \"package-default\",\n    \"selectedByOverride\": false\n  },\n  \"reconciliationPolicy\": {\n    \"id\": \"milestone-loop-source-reconciliation.v1\",\n    \"nextProposalPath\": \".agent/next-milestone.json\",\n    \"requiredReviewChecks\": [\n      \"completeCommitLineage\",\n      \"protectedIntegrity\",\n      \"noFabricatedHistory\",\n      \"commandOwnedEvidenceValidity\",\n      \"verificationTierNonAuthority\",\n      \"invariantSuiteQuality\",\n      \"selectorShadowOnlyEnforcement\",\n      \"telemetryNonSemanticBehavior\",\n      \"artifactContainmentAndNonDeletion\",\n      \"stateMigrationAndRecovery\",\n      \"verticalMilestonePolicy\",\n      \"dependencyValidNextProposal\",\n      \"noScopeReductionOrSuspiciousShortcut\"\n    ]\n  },\n  \"output\": {\n    \"verificationManifestPath\": \".agent/verification-manifest.json\"\n  }\n}\n",